Key Base Phrase,ENVIND_P,ECOR_P,GWSYA_P,UEF_P,AGIND_P,IEF_P,PEF_P,SAI_P
0,The natural environment in and along rivers and lakes ,Local businesses that provide the community jobs and income ,Local groundwater supplies,Community residents and businesses,Farmers,Large industry such as mining  and material processing,Power plants,Water Supplies
20,"is no longer viable. Air quality is poor, heat is undesirable, and recreation is limted.",are no longer viable.  Jobs and income have rapidly declined.,will soon be depleted.  Other sources of water or drastic reductions in demand will be needed.,are complaining that it is to expensive and not enjoyable to live here.,are finding it hard to remain in business because the cost for ultra effcient farming is high.,are finding it hard to remain in business because the cost for ultra effcient farming is high.,are struggling and price of electricity and brown outs is increasing. ,are not sufficient to meet demand resulting in a large deficit.
40,"is declining.  Air quality is worse, heat is inreasing, with fewer recreation opportunities.",are declining.   Jobs and income are declining. Peoplle are worried about the future.,are declining.  It is unsure how long groundwater will last.,are very efficient with there water use and understand that some sacrifices are needed to be susutainble,are using very efficient farmer practices even though the cost to do this is higher.,are using very efficient farmer practices even though the cost to do this is higher.,are agresively lowering water use  with slight increases in electric prices.,are not sufficient to meet demand resulting in a small deficit.
60,"is stable but stressed.  Air quality is stable, heat is bearable, and recreation is stable.",are stable but stressed.   Jobs and income are slowly growing.  People are hopeful.,are stable.  Though drought or rapid demand increase may cause problems.,are efficient with the water use.,are balancing efficient farming with the cost of agriculture.,are balancing efficient farming with the cost of agriculture.,are shifting to lower water use technology and spreading costs over time.,are in balance with demand.
80,"is doing well. Air quality is imporving, heat is stable, and recreation is increasing.",are doing well. Jobs and income are growing.  People are content.,are increasing slowly.  Chances of surving a long term drought are good.,are using more water than is really needed to maintain the quality of life and economy.,are using more water than is needed to maintain a viable agriculture economy.,are using more water than is needed to maintain a viable agriculture economy.,are keeping electricity prices low while making efforts to reduce water use.,are larger than demand resulting in a small surplus.
100,"is thriving .  Air quality is good, heat is declining, and recreation is excellent.",are thriving .   Jobs and income are booming.  People are excited.,in excellent shape.  Chances of surving a long term drought are excellent.,are wasting water that could be used for other desirable purposes.,are using water to maximize economic gains despite potential impacts on long term water sustainability.,are using water to maximize economic gains despite potential impacts on long term water sustainability.,are using water coolimg to minmize costs despite impacts on long term water sustainability.,are larger than demand resulting in a large surplus.